content	score
国庆出门真就是各种看人啊，哪儿哪儿都是人，要疯了。不过话说武侯祠也没什么看头，刘备、诸葛亮蜀汉君臣合祀祠宇及惠陵组成。惠陵还挺朴素的，就一个大土包，其他的都是供的一些石像。还有很多宋代的各种浮雕。不过里面很多石像做得挺萌的。没有什么文化底蕴的来看这儿确实没什么意思，只能看着玩儿。个人还是比较喜欢自然风光。	1
网络购买很方便，也不用再去排队了，不知道为什么一张身份证只能购买两张，我们一行四个人，所以用了两张身份证，还是很好玩的，滑雪场玩的不想走了	1
武侯祠就和锦里一墙之隔，到了晚上还有警察，听说白天人很多。武侯祠有很多侧门，在逛锦里的时候一直有看到，但是晚上都锁起来了，没办法进入。	1
游人到了这里就必须要来的地方，等你看见真的了，也就是那回事了。	0
孩子看的很投入，对于我这个历史白痴，就看看古色古香吧，红墙夹道翠竹掩映，很美	1
来过，这次再来是陪妈妈一起，像一个大公园。此去看到一些十来岁的小导游在讲解，正是旅游旺季，人比较多，是成都市内必去的景点之一啦。	1
非常值	1
有很浓的历史文化气息，整个景区wifi覆盖，可以关注门票上的二维码微信公众号，听免费导游讲解。关键是网上订票有优惠哦	1
出票很快，武侯祠门口就可以换票，不错的	1
《武侯祠》（作者：郭安超）天下三分天府窝忠义智慧见诸葛人心离向定兴衰莫等阿斗敲破锣（成都因武侯祠而智慧，智慧并忠义，这就是诸葛的魅力。到成都不得不去武侯祠）	1
预订很方便，游玩自由，不紧张。	1
好就一个字，环境优美，解说也不错。	1
三国真英雄，刘关张结义，后世永不朽。	1
武侯祠里面陈列的都是三国里面的著名人物、需要一定的历史文化你才能真正的了解。如果你对三国有些研究不妨去看看吧！	1
不值得去游玩，烂地点。里面没几只动物。	0
其实没什么风景，只是坐着索道过长江。。人多的时候简直就肉挤肉。。。	0
丞相祠堂何处寻，锦官城外柏深深。红墙绿影，值得去看看	1
带孩子来成都旅游，特地去了武侯祠。整个景区环境特别美，且有浓郁的文化氛围。让孩子走近三国中的人物，感受诸葛亮的智慧谋略及鞠躬尽瘁的精神，可以说此处是个不错的选择。	1
喜欢历史，对其了解的可以看看，不了解历史的里面就是个大公园，不过挺漂亮的	1
三国迷可以去一下，地方不大，个人认为门票略贵！	1
慕名而来，古老而富有历史痕迹。	1
订票快速，取票方便，语音导游非常人性化～	1
票价很贵，也没什么好玩的。真的浪费钱	0
非常值得去的一个好地方，设施齐全	1
山上的雪很厚，白茫茫一片，玩了滑雪，还有其他几个项目，小盆友开心啊	1
祝附近就去了，有一定特殊意义，有小吃街可以逛	0
老婆儿子都没去过，所以去看看，但是感觉人文的东西性价比真不高，就一些塑像而已。。。。。。	1
是帮父母出去玩预订的，还可以吧。	1
值得去学习的地方，知识面很广，植物也比较多，学习古人文化	1
还是不错的景点，有的自动解说很方便，直接用手机扫描二维码就行，免费的	1
酸辣粉挺好吃的''凉拌的像是凉粉的东西'还有小天鹅火锅'量足	0
红色景点，免门票，离渣滓洞很近，可以去感受一下。	1
来到西岭雪山️，取票方便，雪多，玩得开心！	1
那么便宜の门票还真没见过，在沿海动不动就是100+，成都性价比真是超级高，就是能不能给动物一个更温馨舒适の住所呀，感觉居住の太撇了～心疼呀	0
6月份去的 ，36真是对北方人来说太热了 。但是成都，我还会再来的。图片是宽窄巷子，浣花洗公园，和燃面	1
取票很方便，里面游玩的人不少，不过有很多殿没有开，有一些展览，能学到不少知识。旁边过去就是锦里	1
不错，讲述古代历史人文化，弘扬传统文化道德	1
建筑一般，历史内容丰富，还不错	1
很值得瞻仰的地方。景区内秩序井然。没想到旅游淡季，雪花纷飞的时光里，仍然有这么多的游客，四川的旅游是火了。老祖宗留给四川人民这么多丰厚的遗产，国家给四川人民这么多优惠的条件，四川人民要珍惜，要感恩。	1
景色不错，庙堂都修缮过，很新。卫生很好，与其他城市的旅游景点相比要好很多。但国庆节门票很贵，40元。	1
没什么意思在锦里隔壁才去的，对历史感兴趣的可以去看看	1
以前随便玩过，这次详细看才发现还那么多可看的东东	1
很好玩，用携程买票很方便，省去了排长队的烦恼！值得推荐。	1
涨知识，不错的旅行体验，就是人太多了	1
带儿子去的  美丽  漂亮   哈哈	1
玩得太开心了，下次还来，携程订票就是方便又划算	1
很不错，到了山下自助取票然后排队上山	1
国庆出游人山人海...跟锦里一墙之隔	1
在锦里的旁边，了解三国演义的人去了应该觉得很有意思	1
武侯祠看着感觉小小的，实际挺大的。感觉逛公园一样，树长得超茂盛的，其实随处一拍都是好看的，就是人太多了武侯祠旁边就是锦里小街，喜欢吃的朋友可以去那走一走，菠萝饭挺好吃的。	1
整体来说还是不错的，风景很美，古迹少了一些。	1
祠本身没什么意思，但是离锦里很近，顺带看看	1
风景特别美，氛围特别浓，热闹亲民，并适合各年龄的人群，环境好，干净。是来成都旅游必去的地方!有文化色彩。	1
买了往返的票，实际只坐了单程，人太多太多太多了，排队排好了好久好久好久！！！	0
景区很小，一个小时就参观完毕！景区门票偏贵，不建议去！	0
香山别墅，以前蒋介石的府邸，后来也用来关押革命先烈，大门很壮观的几个大字，让人耳目一新，很有意义，值得来游玩一下，接受革命教育。	1
景色优美，历史悠久，文化厚重，是教育小孩子的好去处	1
取票方便快捷不用排队。景区滑雪场有小吃餐厅，卫生间也干净。一家老小滑雪，照相耍的非常开心	1
“窗含西岭千秋雪，门泊东吴万里船”，大诗人眼中的大美雪山，在今天仍然如梦如幻。雪山、云海、暖阳......美丽如童话世界	1
年年来西岭雪山。收获不同的快乐！:::::	1
成都动物园是成都比较大的动物园，里面品种挺多的，环境也挺好的，最好的还是大熊猫区，门票也不贵，还是挺休闲的。	0
武侯祠非常值得去，扫描微信有每段讲解，原来没想到刘备的墓原来在武侯祠里面，特别是攻心联，一定要听讲解。	1
4分钟时间，没啥看！不值票价！	0
取票离售票处一段距离，要找一下，不过还算方便	1
门票上有二维码，扫描可以有讲解	1
周末去很多人，起码要排一个小时队，白天景色一般，晚上漂亮很多！过江全程需时不用5分钟，吊箱内很闷热。平时人少的时候去还行，周末不建议。	0
上次来正在改造，这次终于很好地感受三国文化。	1
实际是刘备陵，庙及武侯祠的合一景点。旁边还有免费的刘湘墓等。	1
非常棒的武侯祠，每次到成都都会带朋友去。。讲解也特别温柔～	1
有导游讲解的比较好，自己玩没啥意思。	1
一般般啦 进去不知道为什么就感觉很怕怕 很阴森的感觉	0
很值得一去，携程订票取票很方便。	1
真的一般，一个车厢最多可以80多个人，根本看不到边上的景色，很无聊	0
还行吧。。。人造景点，没那么好也没那么不好	1
从小听《三国演义》长大 怀着这份情结游历武侯祠 诸葛亮一直是百姓心目中的千古一相 小说中更是把所有人物的优点集于其一身 作为小说的男一 在他去世后的故事就黯淡了不少呢 能够来到这里瞻仰他的塑像 也遂了多年心愿	1
人工导游很少，要等半个小时。走马观花转了一圈	1
取票时等了一点时间，不过整体还是不错的	1
成都必到景点，值得一游，喜欢成都的慢生活！爱上成都	1
门票小贵，不过里面布置地还算精心，且地处闹市，属于三国粉和成都到此一游者必到之处，旁边就是锦里，可以联在一起玩。虽说是武侯祠，但里面实际上下葬了刘备墓，供奉了刘关张的桃园三结义，看说明发现虽然刘阿斗贪生怕死，可是刘备另外一个儿子和诸葛亮的两个儿子后来都是为了蜀国战死的，好可惜。	1
感觉还不错，电子导游介绍也详细，就是天气热，影响了游玩的兴致。	1
武侯祠离锦里很近，几百米的距离，绿色植物比较多，没有跟团，所以看到的典故没有那么多，联系买个电子导游听听	1
从市区到景点的路一百三十多公里，竟然走了四个半小时，那叫一个堵！高速公路根本没有速度可言。景区外部都在施工乱七八糟，除了石刻稍有价值外，其它一无是处。	0
大自然鬼斧神工，还是比较美的，就是跟团吃饭太啃爹	0
成都武侯祠必须，历史悠久，文化深远，中华文明重要组成部分	1
西岭雪山推出了很多好玩的项目，还、布置了灯会，各种维妙维肖的彩灯，增添了浓浓的节日气氛。	1
不值，不知道进去溜达了一圈看到了什么。	1
有讲解器游览会更好一点，景点可租，门票加讲解器一起就贵了一些。	1
天坑很深，有瀑布！气候湿润！！！	0
除了人多就是人多，满满的人头，看不见几个熊猫，一个山坡一个熊猫，可能是因为人太多了，熊猫不配合，吃一会就躲起来了，躲到竹子林里看不见，没有什么好的体验，人挤人，人挨人，推荐过节期间不要去，真的会被挤死，我们是春节期间去的，可能有上万人，停车场没有位置，车位停的满满的。走很多的路，看不见几个熊猫，整体感觉很一般，票价很贵，为了看一眼熊猫也不容易。	0
取票方便，就在门口，总体感觉还不错	1
就是一个车厢子然后被索道传送两边，和缆车差不多的概念，现在逐渐被重庆人做为交通工具。不过可以空渡长江那种感觉还是蛮不错的，就是去的时候门口在修什么，差点没找到	0
讲解的很好，对历史感兴趣的可以参观下	1
国民党反动派的行缘，残害革命同志的地方，里面的刑具看着让人毛骨悚然。重庆的天气实在是太热了。虽然是免费的但逛了一趟汗流浃背。	1
可以让孩子多多了解历史，值得去的地方	1
携程买票很方便，打卡景点文化底蕴	1
里面并不大…很快就可以逛完，可能更多的意义在于了解历史吧，但是相较性价比来说…门票还是贵了一些…感觉有些不太值得…不过侧门就是锦里…这一点倒是很得游客心意吧，一次逛两个地方…逛累了就可以去锦里吃	1
适合有点文化素养的人进去盘桓半日，拜拜武候。只想到此一游的在门口照张像就好了	1
南方雪景……美丽冻人，娃娃非常开心，尝了雪，淡淡的味道	1
一定穿长裤！！一定带花露水风油精！！讲解可以有电子的那种，其实也可以在讲解员后面蹭啦(捂脸)，英文讲解也可以蹭一蹭啦～～	1
好很好非常好方便快捷，一定好评。	1
唯一的缺点：门票贵了点，但你看到诸葛亮写的对联再沉思半个小时，如果对你人生有帮助，也就值了交通方便，挨着锦里，吃小吃就过去吃了。	1
总体来说，还可以，能了解到三国时蜀汉的历史，特别是带孩子去，更有意义。	1
挺好，、出票速度很快很方便。。	1
想补三国历史的可以去看看。。。	1
大足石刻本身非常值得一看，但重庆市内的很多旅行社提供的一日游都会先带游客去一个叫“佛祖寺”的地方（也在大足县城），那绝对是一个骗人的地方，寺里的人会让游客“捐功德”，骗钱的！！非常可恶的是：在佛祖寺浪费掉一个小时左右，然后导游会带你去吃午饭，下午剩下的看石刻的时间非常紧张，整整一天的行程，看时刻只有1小时多一点，根本没法好好领略石刻的魅力。所以建议大家自己去大足，实在要跟团的话，一定要强调：不去佛祖寺。我们当时在重庆跟的团叫：重庆美丽华旅行社有限公司，导游姓杨（女的），手机号：13098778676。	0
现在在维修，别浪费打车钱了！！	0
武侯祠门票60，对于喜欢历史，喜欢三国的人来说是很值得的，里面的东西我反正是看不懂，但是三国文化气息还是很好的，来成都旅游必去景点	1
。不是很懂三国。走马观花。一个小时差不多。环境不错。	1
小朋友们的游乐天地，雪景非常美	1
去过了，感觉挺好，来重庆第一晚，朋友就带我过去那边吃饭和玩，水帘洞别有一番感觉	0
一行十人玩要，小孩玩得挺开心的，只可惜没遇上下大雪，有机会再来。	1
赞赞赞，雪景很美啊，难得一见！	1
武候祠很值得一看，扫门票的二维码，可自助导游。	1
取票很方便快捷 就在大门口。园子不大 一俩小时就转完了。微信关注可以听讲解。人很多，花儿都开了。很漂亮。	1
我好喜欢里面的银杏树，除此之外，60元的门票性价比不高。	1
非常一般，没特色。不知道为什么网传的那么好	0
人比想象的少，缆车那里需要排一下队，大概20分钟	1
门票是六十，从携程便宜几块钱一张，主要是方便，刚进去还以为就是刘关张的三尊佛像，往西走你才会发现别有洞天。里边美景数不胜数。景色宜人，环境优美，真心有就在成都颐养天年的想法。太美了，因为上传图片有限，只能分享几张个人感觉还不错的。成都，这个城市一定要去一次，吃吃吃，逛逛逛.	1
大小朋友都很欢喜，明年继续……	1
功盖三分国，名成八阵图。江流石不转，遗恨失吞吴。 诸葛武侯--诸葛亮三国代表人物 关于他的传说太多太多,写给刘阿斗的--出师表 也是聪明的象征 周瑜相爱相杀的好基友。	1
在携程网上买票取票很快，几乎不用排队，西岭雪山的风景也很好，天气晴朗时坐日月坪索道上山景色美的像画卷～	1
很棒，期待下次再去，听着故事很快融入了进去，取票方便	1
还不错，锦里就在旁边，一定要早去，不然就是看人	1
映雪广场和日月坪完全是两重天，非常漂亮	1
很值得去，很有历史感，去了很受教育。	1
网上订票真的太方便了，直接刷身份证就可以取票了。雪山也太美了，下次还用携程订。	1
里面是刘备墓地和诸葛亮祠堂，很有历史底蕴和厚重感，红墙夹道走一走很浪漫	1
挺好，方便，有电子讲解了解历史	1
赶上大年初一到的人哪叫一个多，一棵树观景台南门最好不去只能打车，还都是黑车，到了山上有雾看不清楚，索道需要排队三个小时，做索道只有5分钟，不如去洪崖洞解放碑溜达溜达～	0
小适合小情侣 朋友聚会什么的 我们带着孩子也就路过一下 觉得房子造的不错	0
滑雪设施很多。 小朋友堆雪人打雪仗玩高兴了	1
很多年前去时门票还没有那么贵，对佛教或历史感兴趣的可以去看看，一定要记得找导游，不然看不懂哈。	0
逛完锦里连着武侯祠很方便就进去了果然是三国名人的地盘景色确实不错园子很精致有一点点三国时期的遗迹巨大的照壁不知名的石棺旧居网上盛传的绿竹红墙果然美墙上斑驳的竹影都很有意境微信扫二维码就可以自动讲解我到现在还能收到武侯祠的推送内容呢	1
大概男生会比较喜欢这样的景点，而且需要有一定的知识储备，否则进去走马观花也就没什么好看的了	1
地道的成都特色，文化代表。三国文化的重要组成部分，在这里可以近距离的感受历史，三国时期的文化与内涵。感受成都人民的当地特色文化，你会不知不觉的爱上这个城市。	1
车多人多，山下和山上的天气完全不同，体验也很好！	1
成都武侯祠的文物区主要由惠陵、汉昭烈庙、武侯祠、三义庙等组成，主体建筑为武侯祠。武侯祠分大门、二门、刘备殿、过厅、诸葛亮殿、三义庙等，排列在从南到北的一条中轴线上。祠内供奉刘备、诸葛亮等蜀汉英雄塑像50尊，区域内还有众多的关于诸葛亮和三国文化的碑刻、匾额等。 武侯祠的园林区，位于武侯祠西侧，原是民国时期四川省主席刘湘的墓园，区域内有石牌坊大门、三洞门、四方亭、荐馨堂、墓室等建筑，是西南地区惟一一座北方风格的陵园建筑群。武侯祠毗邻锦里（锦里民俗区），可以一并游玩。	1
非常幸运赶上活动30元一张门票遍逛遍武侯祠，正常票价60元。学习和体验三国文化的绝佳去处，有三国迷或者带孩子去真的非常棒，即便不了解三国，连接wifi可以有讲解参考，科技与文化相结合，非常棒，有各类历史人物肖像，古代石碑等，看看自己能认出多少字吧。地理位置优越，旁边就是锦里，交通便利，地铁、公交均可到达，走累了可以去锦里吃小吃。园内有几处景色非常优美，拍照的小伙伴准备好相机，寻找这几处美景吧	1
主要是人太多了，都在看人了，好辛苦	1
虽然只是个4星级景点，但是只知道所有成都旅行攻略里都少不了这个景点，但是，还是去之前网上看好景点介绍，感兴趣的再去吧	1
太烂了，只有索道，还贵呃呃	0
喜欢三国历史的一定不能不能错过！	1
门票太贵，划不来，上山以后什么都是钱	1
很好，武侯祠里面的环境很好，保存的也很完整。	1
阳光明媚的一天，真怀疑山上没有雪，但是我真的错了。滑雪场真的很好玩！各种娱乐项目。	1
人多的时候，这种方式订票很方便	1
感受三国，蜀风雅韵！桃园结义！	1
票价有些不值，去的时候好多景点都在修，那段红墙都被围起来了。去了一定要连wifi加景点微信听讲解，很方便的。	1
人太多热晕我了，也没看到几只。熊猫宝宝倒是超级可爱	0
碑文字写得棒极了！园艺盆景很漂亮！三国的历史人物大家都熟知，没多大看头。	1
没去的，可以去一次逛逛，反正门票没多少钱，涂个开心	0
处处有惊喜，看看梁上发现有字。旅行的人有点多，不过后面竹林还不错。桃源三结义，锦里小吃都还可以，就是有点小贵，但对于古巷来说还是良心的	1
不错，网上订票方便，不用排队了	1
五一那天去的排了两个多小时的队花了十块钱和五十九个人挤在一辆车上六分钟的单向索道不站窗边根本看不到两江景色说实话去一次就够了不是凑热闹只是单纯去体验一下重庆毕竟长江索道这么出名要看江景可以去朝天门或者是去坐轻轨2号线	0
武侯用满目的金黄银杏来，边走边听武侯祠的解说，也了解了一点知识不过里面布置地还算精心，且地处闹市	1
交通方便快捷，取票也很快，值得推荐	1
解放碑其实也没说的那么好，就是吃喝玩乐地方，所谓重庆出美女这话太假根本就没有，最多是重庆人皮肤好点，因为这里大多都是阴天气候养人而已。	0
古香古色，很有历史年代感。走进去感觉置身在蜀国	1
就在锦里旁边，三国主题的景点。到处都是刘关张和诸葛亮的相关祠堂，可以回顾当年的历史故事。出名的出师表等历史故事都记录于此。里面有个惠陵，相传刘备就葬在里面，主要是个小土丘。三国历史博物馆里面有三国时期的一些文物值得一看。	1
鸳鸯池和日月坪一个阴雨绵绵雪气连天，一个阳光明媚，第一次到达三千米海拔的高山上，太美了，不枉此行	1
重庆土人，觉得没得太多意思，但是这样的交通方式，对外头的朋友吸引还是很大的，欢迎大家来重庆耍	0
老景点了，还不错，关注微信可听解说。买门票应该送一套明信片，却告知发完了，暂时没有，不满意。	1
铁树很有特点 值得去看看 还有盆景！	1
人很多，里面还挺好玩的，值得去	1
很不错，直接上山顶，天气很好！景色很漂亮！！	1
神奇，景美，值得一去，建议去之前先看下三国演义，了解足够的历史相信会对这地方更感兴趣。	1
和白公馆一样，渣滓洞都是当年国民党军统监禁，迫害及屠杀异见人士的地方，但由于在此进行了一次非常严重的屠杀事件，故更加显出了国民党军统如何的灭绝人性。而实际上，因有不少卖纪念品的工人员在叫卖，徒令原本应是很庄严的环境登时商品化和庸俗了不少。此外，亦令环境很嘈吵，影响参观时的投入感。	0
非常方便的电子票，武侯祠值得游览。	1
成都的标志性景点，其实是几个景点的合集，皇叔的墓也在里面，还是值得一去的	1
去年去的，感觉一般，路上排队等待时间太久，雪也有些化了。。。	1
从上往下看挺壮观，从下往上就普通了，而且因为开发，修路，天坑坑底路两边都是乱石头	0
很好的地方  小吃不少。也有三国历史知识	1
历史悠久，古色古香，了解历史的好去处。	1
个人觉得解放碑人太多，如果喜欢逛街的，可以去 	0
“三国迷”必来的地方，有很多美女导游，不听讲解没意思。从这里后门出去就是锦里～小吃一条街	1
我们在第一天上午从茶店子客运站坐车到西岭雪山，大概2个多小时吧，到了后就买票，当时已经12.多了，上山还不算太挤，主要是下山的时候，排队就花了2个多小时，所以建议早点下山。到了滑雪场基本上一个项目都要30yuan，其他鞋套呀，穿不到多久就坏了，建议先去阴阳界，在到滑雪场慢慢玩，这样就不用担心上面的缆车关闭了，而且上面的景色很美的。	1
很不错，很优秀，很可以，巴士很	1
第一次来西岭雪山感觉很不错，就是吃有点小贵，而且味道不怎么好，建议自带干粮，方便面，自热饭更合适。门票120，鸳鸯池索道120，60以上老人仅免门票，1米2以下儿童全免。这次没有去日月坪，打算明年过年再来看雪的时候，去日月坪玩。	1
人流量比观音街少很多，没美女！坑爹的好吃街，不到一百米，可选择的美食不多，特色不明显	0
还不错，我们去是花钱讲解的，其实直接刷码就可以了	1
很好玩的地方，环境很美，绿树成荫，是成都必去的地方	1
没有时间过去，票也不能退，一千多块钱就这样送给他们了	0
国庆出游人很多，取票方便，景区亮点就是红墙夹道	1
感觉挺不错的 吃的玩的买的东西很多 景色也特别美 只是想拍全景照的话不太容易 元旦去的 人太多了  摩肩接踵全是人 景色是真的美	0
我们的今天是无数像江姐那样的先烈抛头颅洒热血换来的，所以不管时代怎么变迁都不要忘记他们！	0
安逸，就是有点冷，多穿衣服和防滑鞋	1
寺庙很一般，里面没什么可看的商业气息很重。	0
环境清幽，主要是看文化，带小朋友去看看，了解三国历史。	1
不值，去了就知道了，转了20分钟就转完了，5A？呵呵！	0
武侯祠的名气无需多言，全世界唯一君臣同祀的建筑群，而且是以臣子为主要祭祀对象。也是中国最正宗的诸葛亮纪念馆。三顾酬知己，一对定江山。	1
网上购票很便捷，不用排队，兑换畅通 ，	1
喜欢三国文化的筒子们的圣地，里面有免费的微信导游和wifi，做的很好，给我这样的游客扫盲了。要是朋友一起出游的话可以到里面的桃园结个义呵。	1
有自动讲解器，了解很多历史知识，值得一游	1
去成都必去的地方，过年时的灯会也很好.	1
很久没来重庆了，今晚和客户去了南山看重庆夜景，在进门第一个大平台哪里，买了三根雪糕，堪比青岛大虾。一根35元，一根25元，一根20元，共计80元。就是街上两三元钱极普通的雪糕。重庆人的好客，耿直。被这三根雪糕彻底诋毁了。大家再去重庆，别忘了前车之鉴，重庆啊啊啊啊，伤不起。	0
景色不错，香山别墅的原貌保存较好！就是小萝卜头被害处不开放，挺烦人！	1
这两天去非常棒，下雪正当时，看完雪景再到日月坪去观光简直美妙绝伦，如果你人气爆棚，绝对会看到日照金山，白雪皑皑、金光闪闪。值得你踏上旅程！	1
体验极差，排队两小时，观景两分钟，略略略	0
购票拿票很方便，1.3米以下的孩子不用票。	1
红色旅游胜地，到此处，能体会到当年革命烈士们为了新中国抛头颅洒热血的精神，是很好的爱国主义教育基地，大家都充满了对革命烈士的敬仰！	1
