content	score
走进武侯祠感受历史，重温三国，电视剧里的画面历历在目，诸葛亮的足智多谋，刘备、关羽、张飞的桃园兄弟情就如人生的一面镜子，令人神往，让人深思。	1
值得带孩子来的地方，景色很美！	1
环境优美，文化渊源流长，出来后就是热闹的锦里！	1
取票方便，索道坐起来也很不错，避开高峰期，能很好的欣赏风景	1
取票很方便，雪很大，孩子玩的很高兴	1
景区是很好的，很长知识，红色教育，这个讲解真的很鸡肋，特别没有用，千万不要买，景区里有标志解说，而且解说好像是很久以前的，景区里对不上哪个是哪个	0
人文景观好，就是门票价格太高，在北京参观故宫也就四十块钱！这里竟然收费七十元！	1
让我最失望的一个景点，排了快2个小时的队，坐了大概5分钟，似乎没什么乐趣，可能是我之前期望太大了吧，估计晚上去看夜景会好看些。	0
进入正题前还是表一表上西岭雪山的困难，和超高的人气。我们的住处驱车到西岭雪山大概有120分钟——前提是不堵的情况下，但是走到下面这张图的地方，上山到风景名胜区的车全部卡住了，倒是不时有车从山上下了，友情告知:前面已经上不去了。 无奈之下，众车只有纷纷调头，只有在西岭镇那前往西岭雪山的后山。这个西岭雪山分为前山和后山，前山就是大飞水景区，后山则是坐索道前往滑雪场。	1
很不错、我去了2次、有历史年代、有机会再去看看啊、值得去了解顺便去锦里玩玩不错不错约定的的的的的的，锦里小吃一条街，应有尽有，各式各样，美。	1
19年前第一次来成都，第一个拜访的就是武侯祠。诸葛丞相的形象在我心中是无以伦比的。19年后再次来成都，武侯祠依旧，只是更加整洁，规范，不过价格太贵了，居然要60元。	1
一般吧，商业气氛浓重，属于不看后悔，看了没感觉那种	0
不愧是西南第一大雪山，慕名而去一点也不让人失望，大人小孩都是兴奋不已，虽然满山雪白，可一点也不冷，下山后去泡个温泉那叫一个爽！	1
携程订票方便又有折扣，好！以后就选携程了。	1
不错的一次参观游览，有文化底蕴，值得去。	1
取票很方便，离我们的酒店很方便	1
喜欢三国的历史的人推荐过来，而且一定要耐心的慢慢发现，旁边就是锦里，人巨多	1
不值得玩的景点 看看夜景就好了	0
桃园三结义，孔明辅江山，武侯祠不错！！！院子红墙绿竹，俨然梦回三国！	1
景点还是很好的，假期就是人太多了。	1
相传是诸葛亮的，挺漂亮的一个地方	1
还不错吧，下次有空还去，我们就是去的有点晚	1
国庆长假，一家老少5口带一家3口共8人去的重庆第一个景点，里头买吃的很多，人更多，外型设计的不错，可近望嘉陵江，孩子玩的很开心，从江北打的两个车，结果一车跑到崖顶，一车在崖底，找半天，呵呵	0
晚上的套票很划算，爸妈不滑雪，就在上边转转，感受一下下雪。工作人员还是不错的，很负责任，态度也挺好。	1
拿取直接刷门票进去，很方便，价格比较实惠	1
上上下下傻傻分不清楚…伙食一般，风景区的东西果然哪个城市都是一样的难吃，风景不错就是了…	0
门票一人10块，进去没什么看的。门口一群算命的，很影响心情。你不算 还要拿着你。 非常不推荐去。	0
除了进门太乱，厕所不好上，其他都还行	0
买票方便且便宜，不影响任何游玩。值得推荐！	1
春节人太多，路上超级堵车。。。	1
不错不错  历史感厚重  寓教于乐	1
我去的时候是早上8点,门票30,当然我有学生证15就进去了.还是很安静,可以说是太安静了,里面有鸟叫声.有辅佐刘备的功臣武将的木雕泥塑,噢,还有个人的生平简介.其实没有什麽特别之处.刘备和他的两个皇后的和葬墓---惠陵,陵前有神道,但是根本无法与西安的皇帝陵墓相比.雕刻简陋,矮小.   	1
映阶碧草自春色，隔叶黄鹂空好音，三顾频烦天下计，两朝开济老臣心。这诗赞的是诸葛先生的睿智与忠诚，鞠躬尽瘁死而后已的不怨不悔是诸葛先生的墓志铭，在武侯祠，我们遇到了小小解说员评选活动，一个八九岁的女孩伴着老师有板有眼，字正腔圆的讲述了许多诸葛先生的奇闻趣事，因为这个小姑娘的精彩演绎，庄严肃穆的武侯祠里多了许多生气呢	1
很不错的地方，带家人去的，雪景很漂亮	1
穿过一个小巷子，在小巷子的尽头还不错的一个寺庙。	0
实在一般，不过过江索道只有重庆走了，所以来了看一下也是可以的！	0
千年足刻，色彩依旧鲜艳明亮。整个景区不大，门票淡季110元。	0
毗邻锦里，看点较少。三国文化气息不足，部分文物不是本土出土。	1
成都武侯祠是纪念中国三国时期蜀汉丞相诸葛亮的祠堂。成都武侯祠现分文物区、园林区和锦里三部分，文物区主要由惠陵、汉昭烈庙和武侯祠三部分组成，我们一个人都很欣赏和佩服诸葛亮的智慧，我也很幸运能来到这里参观。	1
要到景区之通车领取，细区因为改造没看到，还有个陈列馆也改造没看到，没啥意思。	1
国庆节小长假，人挤人的节奏。感觉是被挤进又挤出的。喜欢里面的故事，值得去。就是人太多了。	1
一般。没什么可玩的，附近施工，一团糟。下次再也不去了。	0
不错的选择！取票方便，景区还有免费的语音讲解或租赁讲解器，方便游玩。	1
就是个山沟，票价偏贵……基本上就是爬山运动锻炼减肥	0
去了一趟，大失所望，跟想像中完全不同	0
爬山比较累，景色还可以，是一处红色旅游圣地，门口有210路公交车可以到市区。很重要的一点，建议自带水，或者在路边有小贩卖2元一瓶的平价矿泉水也不错，因为景区矿泉水超级贵，门口百岁山大瓶10元。人很多，注意错峰出行	1
景点还是不错的，不过携程没有儿童票售卖，且买的票儿童不能扫码入园，必须要再去售票点取票	1
怎么说呢！还是可以去看看，门票也不贵，但是，要想看动物的话就最好不要周末或节假日去，否则就是去看人	0
很好玩，适合各个年龄段的人滑雪玩耍	1
我是第一次去成都游玩，我不会说话更加不知道如何给大家介绍这个景点有什么亮点，我只知道既已来到了成都，这个景点是必去的一个地方。。。	1
说的要绑定身份证拍照，其实并没有，感觉很水，景区里稍微好点的地方都是收费的，商业化太重，连好点的坡都被圈起来收费了，没意思	1
能够领略到三国时蜀国的历史，文化，值得带孩子游玩	1
很智能很好用，自动识别地点，价格公道	1
取票方便锻炼身体，为了取票跑了快一公里。	1
大热天爬那么多楼梯真的累死...脚快断了 属于不去遗憾去了后悔 主要陪父母看 房间内基本没当年实物 就是空房间贴老照片 介绍文字那些 像我这种走马观花不看图和文字的完全等于爬山加看下房子...	0
过年到成都游玩，赶上庙会非常热闹，游客很多	1
订票方便，但其实可以在门口买票的，旅游直通车特别方便	1
比较远，除了自驾其他方式过去交通不便利。门票价格偏高，性价比一般。	0
非常值得一去的目的地，滑雪爱好者的天堂！而且携程订票也非常的方便，春节景区爆满，人山人海的，特别热闹，景区的安保工作也非常的周全！！	1
还可以吧！也就那样吧说不上多好，但也不错的。	0
人特别特别多，上午10点出发，还没有到景区门口，出租车就不让进了（成都的出租车宰客！）走了好远，到景区门口排队2个小时才进去，12点多进去景区直通车停运！既然停运为什么还不限流！爬山绕了好远才看到几只熊猫，多数睡觉了，已经下午3点了，走出来4点多了，门口还是一大堆人排队往里进！说实话，大概所有景区只有这个景区适合亲子吧，其他宽窄巷子啊ifs啊春熙路啊商业街就是没啥意思，服务也不好，吃的东西还有坏的一股馊味，真的很差了，绝壁再也不会去了，和重庆没法比了，住的地方都是些个人开的公寓没有任何服务死贵，酒店是大堂还能看的下去，房间就能摆一张床吧，20多平，春节期间就是抢钱的！人民路一条街都是残疾要饭的，真是醉了！	0
游乐设施比以前好多了，小朋友超级喜欢	1
文化积淀很深，也很安静，能了解历史又能安抚心灵，值得一去	1
价格优惠，取票方便，夜场滑雪不错	1
景区服务做的很好，风景也很漂亮，	1
里面可以看到诸葛亮像和刘备像，怎么说呢，有点走马观花，不过可以先上网查一下武侯祠的历史，有点了解之后再来会比较好，主要是要看历史功底。	1
很不错，很优秀，很可以。很不错，很优秀，很可以。	1
这个景点是成都著名的景点，去成都必须去玩的景点，确实不错	1
人太多，熊猫那里挤都挤不进去，观光车也要排好长的队，比较大，一直走，每一个馆都隔得有点远，还不如去动物园，动物还多一些	0
好好！！！！！！！～～～～～～～～	1
值得一去，和锦里挨着的，成都著名景点之一	1
吃在锦里 ，玩在武侯祠，休闲在棋牌室，还有扒耳朵，不错不错????还有一壶好茶（棋牌室里的，就是忘了店名）	1
这应该不算景点吧，不过但是重庆标志性的地方，所以既然来了重庆还是得看看逛逛。商圈以解放碑为中心，商场很多，晚上很热闹。听说解放碑美女集中点啊，好像也没看到多少哈哈～	0
罗汉寺全程只需要半个小时，看看罗汉堂，大雄宝殿烧个香点个烛。因为还在装修，所以可参观的较少，如果在附近酒店住的话，第二天一早可以去看看，旁边就是1号线6出口，还有长江索道。门票10元。	0
这里是成都市的地标建筑，有很多交通线都有专门的这一站。这里几乎也是旅游的必到之处，有很多旅行团在里面。规模非常大，这里也是国内唯一一个君臣合祀的庙宇。来到这里，主要是体验三国文化。这里不仅有三国的很多的故事，而且有很多的属相，据说很多，还是前朝的遗物，所以只能到这里来看一下。现在他做的很好的，是有手机的到来，所以你可以下载一个app，在这里面可以仔细的听讲非常的精彩。如果有时间的话，可以到旁边的锦江古镇也非常不错。	1
三国胜地，历史悠久！帝王将相，名垂千史！	1
都在玻璃窗里面，臭气熏天，有些动物根本看不到	0
好玩，比线下购买便宜，值得一看	1
武侯祠，是一个将军的祠堂，交通也是很方便的，坐335来这里的。	1
一车几十人根本看不到窗外，观感体验极差，往返30乘坐2分钟，差评不解释	0
不值这个价，景点太单一，…………	0
历史文化旅游点，值得带孩子去了解历史。园林很美，尤其是盆景园，儿子很喜欢。边上就是锦里，很多美味小吃，两个景点完美结合。	1
特别好，4人一起来，真雪的，摔起来不痛	1
最好自带太阳镜，不然眼睛都睁不开。	1
景区不错，讲解机很实用，不过二十贵了点，十块就值了	1
看着售票窗那水泄不通的人潮，立马选择在携程订票，3分钟就搞定，方便	1
春节人太多，组织不合理，停车场离景点入口比较远，接驳的摆渡车也没有，走到景区入口就累了。在景区入口排队排一个小时，人群没有秩序，险些发生踩踏事件。大熊猫都慵慵懒懒的趴在那里，太阳产房说是有熊猫宝宝，好不容易挤进去看到的是视频，视频在家就可以看啊，干嘛去挤呢？为什么不提前告知，可以选择不去。差评	0
武侯祠是关于三国刘关张和诸葛亮的纪念馆，里面有很多关于他们人物的介绍和雕像，还有桃园，武侯祠地方很大，跟一公园差不多，走的地方很多。	1
推荐的地方，厚重的历史底蕴。感受不错，服务也蛮好，门票稍贵，60。	1
从重庆市区过去挺远，高速堵车，到那风景还行，门票略贵，景区逛完出来需要等景区班车。	0
很好很满意 景点有WiFi 可以听介绍	1
建筑有历史的沧桑感，可以学习感受一下历史	1
春节人太多，没有做到预案，各种不方便，	0
这是三国诸将的合祀之处，看过三国演义的话，这里的人物您都不陌生！这里是进行实践教学的最佳场所，老师和学生都值得一去，定会让你不虚此行！（因此地均为我所崇敬的人物，故不敢偕越拍照。）	1
还是不错的，好多人都在网上买！	1
为啥所有的景点，都要修成停车场离售票处2km，售票处离入口2km，出口离停车场2km的傻叉模式？以为在动线上强迫游客经过商业街就能带动消费了吗？连电瓶车的消费都带不动啊！大家都知道了，即便坐了电瓶车还是要走很远的路啊！毫无意义地消耗步数，浪费游客时间！	0
大路上都是旅游大巴，人真的太多了。幸好提前一个星期把票定好，省了排队买票之苦我太机智了	1
景区还是做得不错的，就是大家的兴致没法带起来，说起来不去景区外面公园景致	1
文化久远！值得回味！桃园三结义！	1
美丽的西岭雪山，一个让人流边忘返的地点。西岭雪山有连绵起伏的山峰，重重叠叠连接在一起，好像一条巨龙，非常壮观飞流的瀑布，又好像挂在岩石上的门帘，阴阳界变化万千的气象，一边睛空成里，一边去云雾环绕。	1
修缮中，看不出古迹，规模小，没有特色。	0
取票非常快！工作人员很热情哦！	1
挺好的，一家人玩的很开心......	1
就是带孩子来看下大熊猫繁育研究基地	0
成都的一大景点，与我们熟悉的历史息息相关，属于当地不错的景点。里面也有一些保存的不错的历史遗迹和展品，是不错的寓教于乐的场所	1
网上预定与景区售票处的价格相同，还可	1
这个项目我觉得还可以，但是买了票后啥子押金卡说的不明不白的，叫押金卡其实就是你要不要选自费项目，比如头盔，防雨衣，教练之类的，我办了个押金卡，就用了30元租了个储物柜，项目还是不错，娃娃比较喜欢	1
也许是我运气不好吧，从卖票窗口开始，工作人员态度就极差，进去买观光车工作人员也是。还有工作时间，标明的是5.30实际上5.10就关门了，呵。真给四川人长脸	0
要说风景不怎么样，主要是诸葛孔明的祠堂，去的人主要是感怀先生的，感受回到三国时代的风云变幻，旁边正好是锦里，吃喝玩乐都有哈	1
一点都不好耍，没有想象中那么神秘，就是上山下山而已，	0
排队很长时间。没有意思。还是两江游值得游玩。	0
就是人家上班的工具，人多的挤死，一点意思都没有！不值得起坐！	0
在国内漂流的少，不好评价，算不错吧	1
名为武侯祠，实际上也祭祀刘备，古色古香，从一个偏门出去就是著名的锦里！	1
景点不错！就是今年过年收钱卖票了。安保不错。就是人太多了！这里是个有故事的地方！要细细品味 人多了不行。	1
就是小公园，还有的就是几个庙里有几个人像里简介，感觉价格有点高。。。。。。。。。。。。。。。。。	1
好多好多人，排队排了N久，结果上去了之后效果差强人意啦，一缆车的人，太挤了。而且说实话景色不怎么样呃...反正我觉得吹的太厉害，挺失望。	0
2019年春节的大年初三，登西岭雪山，中午到达花水湾放下行李，乘车前往西岭雪山脚下，本以为过了高峰，没成想等缆车排队仍排了两个小时，春节假期实行按号段排队，我们已经是16000多号了，当天晚上返回山脚看到有17000多号。终于乘上缆车，很快从1300米抵达2000米，就能看到积雪了，乘摆渡大巴到滑雪场，密密麻麻全是人，滑雪是来不及了，就骑了个雪地摩托，因为最贵，所以人少。其他的项目没啥意思，更高的日月坪也没兴趣去，便返回下山缆车的排队队伍中，官方还放大喇叭建议能力足够的人步行下山，山下还能退已买的缆车票，七八百米的垂直落差，腿打闪闪就算了，把膝盖给弄坏了可划不来。下山之后正规的班车早没了，都是揽私活的司机。	1
很方便，取票自助的不用排队，不错的一次旅游	1
挺好的，就是当时去的时候没有下雪	1
方便快捷，不用排队！！！！！！！	1
商业气息过重 不过景色不错 现代与历史的结合	0
好的好的我不爱你么么哒欧耶好的	1
重庆老民居的建筑样板！值得去看一看。	0
这里是一个祠堂之类的景点吧，里面景色还行吧，如果有三国情意结的可以来逛逛，非常靠近锦里，顺路逛逛还是不错，不过是需要门票的，大家自己考虑吧，外围不收费，内围有个小博物馆，还有刘备的墓在里面，门票是80！	1
赞一个赞！不错的，斑斑驳驳棒棒棒	1
诸葛亮的传说让现代人慕名而去武候祠参观。	1
熟悉三国文化的可以到此看一看，边上就是锦里古街。但是，就景区内容和规模来说，60元一张门票性价比真的不高	1
压根没用，不给我退，浪费钱！！	0
武侯祠大门隔壁游客中心拿票，方便。	1
天气很好，阳光明媚，是个出行的好日子！到了滑雪场又是另外一个天地。	1
长江索道 单边一次就够了 很无聊的……	0
一切都不错，孩子非常开心，听我的，一定要坐索道	1
成都特色景点，值得一去，了解了很多三国时期蜀汉的知识。	1
春节去的，疯狂排队，里面也没几只熊猫看，跟普通动物园区别不大，白排队	0
价格便宜，挺方便的，真的很不错。	1
很不错，有历史底蕴，就是小了点，一下子就逛完了	1
历史悠久，免费微信讲解，各方面都很好	1
还可以吧！古色古香的！但是我觉得小吃一般，主要还是外地人吧！	1
还行，喜欢历史的朋友可以来看看。	1
成都市区内方便，周末都可以带娃转转	0
地方不是很大，但是有点特色，还是值得一去的！	1
不值得，排队两小时观光两分钟，还不如坐在地铁上看还舒服。真的不要去（除非你想感受一下排队的快乐）	0
小园子很精致，风景还是不错的，虽然不大，但是很有味道，就是门票小贵。	1
135的门票包含来回巴士，和个电梯，问题是等电梯用了45分钟，还是周一，周末就不敢想了！到景点里游玩玻璃观景台，电瓶车又要重新收票，	0
三国迷必去，哈哈，不需要讲解。。。反正刘备和诸葛亮这里都是衣冠冢	1
真心不错，里边很大，讲解很不错！	1
假期不要来，人太多，太乱太乱太乱太乱	0
坐直通车去的，不得不说成都景区直通车真的很方便！武侯祠也不错啊，各种人物，各类盆景景观！有段两边都是红墙的路，走在中间很有感觉，也有点怕怕的，问题是一个人。	1
好城好事好多车，天太热不适合旅游，天太热不适合旅游	1
武侯祠的环境挺不错的，景色挺好，有一个很大的湖。	1
很大，有不少历史典故，挺有意思的！	1
冰雪大世界，孩子很欢喜，墙裂推荐	1
我们是12月初去的，来回都是索道，索道票套票160一个人，到山顶，如果只买那个到半山的话貌似没什么看头。本来是打算去滑雪的，结果滑雪场还没开，工作人员说估计冬至以后就会开了，然后索道下山关闭时间下午四点半，山顶只有一家酒店条件听说很一般	1
网上订票，免去了节假日现场排队，很方便。	1
武侯祠有历史感，网上门票优惠力度再大些就好了	1
文物较多在市区很方便诸葛亮在哪？	1
去的时候能见度太低，所以很多项目玩的不是特别爽，但小朋友开心极了，满地打滚，如果冷的时候去应该特别合适	1
不错，挺好玩的。就是雪下的不大	1
全是人啊！全是人！过节期间还是别去了，走了两个小时看见了两只熊猫！想看熊猫宝宝是不可能的！立马走人了！	0
君臣庙，山水秀丽，锦里环绕。情谊大过社稷。	1
人真是太多太多太多了，特别拥挤	1
里面还不错，但是国庆人是真的多	1
景区一般吧，不是很大，有时间可以去溜达溜达，时间紧可以忽略	0
成都武侯祠是全国唯一的君臣合祀的祠庙。从正门进去，两旁有唐碑和宋碑，再进去就是刘，诸葛的大殿，文臣武将分立两廊，旁有岳飞手书的诸葛亮的前出师表的拓片。顺着一道红墙，可以来到惠陵。惠陵附近还有一个三国文化博物馆。武侯祠一边通锦里，一头通西区公园，公园不收门票。武侯祠门口有景区直通车，可凭门票购票坐车前往各景区。	1
文化底蕴深沉，地处闹市，但是人文环境不错。	1
这个地方值得一去，感受中国历史文化	1
很干净很有历史气息，水景真的不错	1
还行六十价格不便宜，老人票去还行。	1
还可以，滑雪不错，我们下午上的山晚了点，不过还是可以的	1
很有文化的地方，干干净净，不错不错	1
用着还可以，就是有的时候定位不准，时速跟不太上！	1
需要门票，但是更建议请个导游听一下讲解更能理解	1
是一座诸葛亮的衣冠冢，前后有三进。	1
周末去的，除了人还是人，感觉一般，也就带孩子去看看	0
很好很好很好很好很好很好很好很好	1
正逢国庆假期，游客甚多，每个景点停留时间不长。园内信号不是很好所以下载的“微信导游”无法正常使用。门租赁语音讲解器排起了长队。在绵绵细雨中匆匆逛完了。	1
上周末去的，景色很美，小朋友玩得很开心，建议景区售票上可以更优化，比如直接刷身份证进去，免票就不用换票，减少排队等候时间。	1
方便快捷，雪景很美，一家人玩的很开心	1
头春节到这边玩，感到了浓浓的春意，盆景、书法都很棒	1
红色教育基地，值得去感受一下。最好现场有讲解。	1
武侯祠，桃园三结义，三国，无论是否对这些感兴趣，都应该去转一转，听听故事，感受气息。面积并不大，按照讲解一路听一路看，最多两个小时也结束了，园内还有很多很棒的盆景，游完武侯祠，突然对三国感兴趣了，想要去了解。	1
号称是三国迷的圣地，其实有点言过于实，里面主要就是一个诸葛亮和刘备的墓地，还有刘关张的三人的雕塑，如果不听讲解自己看，根本就是走马观花。因为我们被《三国演义》给误导了，其实很多小说情节和历史故事出入很大……	1
很好，玩的很开心。携程订票很方便	1
好像没有收费，性价比很高，但是真不明白4A怎么来的，都是餐厅或卖东西小店或者推广旅游，建筑物应该是老房子加建的，外形可以，没有特别让人流连忘返的点子，电梯数量不多，人多排队久。	0
很方便，一路用身份正就可以了，这个季节去，人也很少，还有很多雪	1
感觉不错的，人文地理都好的，和美食街相邻！	1
玩得非常开心，积雪很厚，时不时还飘些雪，对于南方人来说，太让人激动了。雪上有很多玩法，这里还有很多游乐项目，试试滑雪也很不错，一旦学会了，你会爱上这个项目。此行收获满满，无论大人还是孩子都开心得不得了，离开时意犹未尽，以后还会来。	1
喜欢历史了解三国的很值得一去。一定要请导游不然真的看不明白。	1
著名旅游景点，不听讲解恐怕很是无聊	1
离成都不远，一天来回足够。超好玩，第一次爬雪山，两个缆车都坐了，爽歪歪，滑雪更是惊喜，88元任意滑，装备全包，哈哈。半山雪大，山顶因为那天阳光充足，暖洋洋的，雪反而少了。	1
带着小朋友去的，大家可以放心，雪上项目安全系数很高	1
一般的，没有以前好看了，卫生有点差，希望以后改进一下！	0
去一棵树可以坐346,347路，在上山的时候可以路过看得到，在四中下车，往回走就可以了，如果是学生去的话记得要带学生证很便宜的，但是看过夜景之后下山会很麻烦，或者往回走坐公交下车，或者打车，因为打车在半山腰不是很方便，大家可以用一些滴滴或者Uber可能会方便一些。景色还是可以的，，千万不要在有雾的时候去玩，会看不到的。。图片是从网上找的，自己拍的已经不见了。	0
下着小雨，依然没有阻挡我们的脚步	1
省去排队的麻烦。就是学生票还需要排队买，如果能一并网上购买就好了	1
窗含西岭千秋雪，门泊东吴万里船	1
